{
  "$schema": "./wizard.config.schema.json",
  "title": "Tasarım ayarlarını seçin",
  "subtitle": "Ürün türü, kağıt boyutu ve katlama şeklini belirleyin.",
  "steps": {
    "category": {
      "label": "Ne Üretmek İstiyorsunuz?",
      "options": [
        { "id": "brochure", "title": "Broşür", "hint": "Katlamalı, çok sayfalı", "icon": "📕" },
        { "id": "catalog", "title": "Katalog", "hint": "Çok sayfalı", "icon": "📖" },
        { "id": "label", "title": "Etiket", "hint": "Ürün etiketi", "icon": "🏷️" },
        { "id": "businesscard", "title": "Kartvizit", "hint": "Tek veya çift yön", "icon": "💳" },
        { "id": "flyer", "title": "El İlanı", "hint": "Tek sayfa", "icon": "📄" },
        { "id": "invitation", "title": "Davetiye", "hint": "Özel gün davetiyeleri", "icon": "💌" },
        { "id": "other", "title": "Diğer Ürünler", "hint": "Menü, fiyat listesi, afiş", "icon": "▦" }
      ],
      "default": "brochure"
    },
    "mode": {
      "label": "Nasıl Çalışmak İstiyorsunuz?",
      "options": [
        {
          "id": "cell",
          "title": "Hücre Yapılı Tasarım",
          "hint": "Excel verisi ve ürün hücreleriyle düzenli, otomatik tasarımlar oluşturun.",
          "icon": "▦",
          "features": ["Katalog", "Toplu ürün", "Excel"]
        },
        {
          "id": "free",
          "title": "Serbest Tasarım",
          "hint": "Hücre kısıtı olmadan özgür düzen. Kapak, kampanya görseli, afiş.",
          "icon": "◻︎",
          "features": ["Az ürün", "Kapak", "Yaratıcı"]
        }
      ],
      "default": "cell"
    },
    "paperSize": {
      "label": "Kağıt Boyutunu Seçin",
      "options": [
        { "id": "A3", "title": "A3", "hint": "297 × 420 mm", "widthMm": 297, "heightMm": 420 },
        { "id": "A4", "title": "A4", "hint": "210 × 297 mm", "widthMm": 210, "heightMm": 297 },
        { "id": "A5", "title": "A5", "hint": "148 × 210 mm", "widthMm": 148, "heightMm": 210 },
        { "id": "A6", "title": "A6", "hint": "105 × 148 mm", "widthMm": 105, "heightMm": 148 },
        { "id": "A7", "title": "A7", "hint": "74 × 105 mm", "widthMm": 74, "heightMm": 105 }
      ],
      "default": "A3"
    },
    "foldType": {
      "label": "Katlama Şekli",
      "options": [
        {
          "id": "none",
          "title": "Kırım Yok",
          "hint": "Tek sayfa baskı",
          "icon": "00-kirimsiz.svg",
          "pageCount": 2,
          "pageOrder": [1, 2]
        },
        {
          "id": "half-fold",
          "title": "Tek Kırım",
          "hint": "Ortadan Katlama",
          "icon": "01-tek-kirim.svg",
          "pageCount": 4,
          "pageOrder": [4, 1, 2, 3]
        },
        {
          "id": "roll-fold",
          "title": "Çift Kırım",
          "hint": "İçe Katlama",
          "icon": "02-cift-kirim.svg",
          "pageCount": 6,
          "pageOrder": [5, 6, 1, 2, 3, 4]
        },
        {
          "id": "z-fold",
          "title": "Z Kırım",
          "hint": "Z Katlama",
          "icon": "03-z-kirim.svg",
          "pageCount": 6,
          "pageOrder": [6, 1, 2, 3, 4, 5]
        },
        {
          "id": "triple-fold",
          "title": "Üç Kırım",
          "hint": "Sarmal Katlama",
          "icon": "04-uc-kirim.svg",
          "pageCount": 8,
          "pageOrder": [7, 8, 1, 2, 3, 4, 5, 6]
        },
        {
          "id": "accordion-fold",
          "title": "Akerdiyon",
          "hint": "Akerdiyon Katlama",
          "icon": "05-uc-kirim-akerdiyon.svg",
          "pageCount": 8,
          "pageOrder": [8, 1, 2, 3, 4, 5, 6, 7]
        },
        {
          "id": "map-fold",
          "title": "Harita",
          "hint": "Harita Katlama",
          "icon": "09-harita-katlama.svg",
          "pageCount": 6,
          "pageOrder": [6, 1, 2, 3, 4, 5]
        }
      ],
      "default": "none"
    }
  },
  "defaults": {
    "bleedMm": 3,
    "safeZoneMm": [5, 5, 5, 5]
  }
}
